,text,Bias/Abuse,Finance/Career,Relationship,Health Concerns,None of them
0,"I'm scared to vent. : I'm not saying this for upvotes. I'm so mad at everything and i'm so sad, and don't know who to tell. The closest thing i have for friends are some of my friends friends on a discord server, and they hardly like me.",0,0,1,0,0
1,How do you get the courage to speak out : Just gone over 4 years of depression. I say that like I have been diagnosed but I am yet to go seek help. So I guess let me rephrase it as 4 years of an internal struggle. It’s started way back in late 2015 when I started to feel this kinda change in me like nothing or no one interested me anymore. I am aware I should seek the necessary help but my life is just a little too complicated for that. For starters there is my family I cannot begin to imagine how I would even start a conversation about this. Then there is my mum who is just my world. She is a deeply pious women and I recall a vivid conversation we had about mental illness and do you know what she told me she said there is no where in the holy book ( I won’t say which cause it’s not that important) that has anything on mental illness you tilt only 2 ways you’re crazy or you’re stressed. I remember feeling unsettled by this as I try to understand her but ultimately it broke my heart because I came to the realisation she could never understand the complexity of mental illness. So I stayed quite for years and I guess I have been staying quite ever since and buried it within me. But I am currently feeling the worst I have ever felt in my life and I don’t know I don’t want to feel alone anymore. Sorry for waffling but I wanted to ask how does someone blurt this out??,0,0,1,0,0
2,"My problems started after my first panic attack which had happened in October. After that I had a lot of anxiety about my heart (bp 140/90) I was medicated with Zoloft for a while, it helped but I didn't want to become dependent on it and I had a lot of side effects. My bp with Zoloft was around 120/70 After some weeks the anxiety came back with horror, fear of the death and lump in a neck, stiffness in chest. My blood thyroid hormones were measured, everything's perfect.",0,0,0,1,0
3,"So again, here I am, with no idea what to do. I don't have any particular skills, besides almost never getting fatigued, the ability to walk for hours on end without getting tired, lifting some pretty heavy objects despite my skinny figure, and a few other things. I know some Korean, and am studying Japanese, Chinese, and Spanish (self taught). The only things of value that I have anymore are my phone and laptop that I've had since I ran away, and I mainly use the wifi at work to access the internet. My only source of sleep is a 30-60 minute nap I manage to sneak in inside the changing stalls at the gym I shower at, unless a coworker is nice enough to let me stay with them for a few nights.",0,1,0,0,0
4,"Bottom line is this is the first situation in a long while causing me to really get anxious. I'm thinking about it most of the time and waffling about it. And today I got the invitation and started looking into flights and transport and I'm overwhelmed. I'm at an age where traveling alone shouldn't be a big deal, but it is, I never have traveled alone aside from a handful of 2 hr bus trips in 2007ish. Any advice?",0,0,0,0,1
5,"I was brutally raped for 2 months. By my best friends boyfriend. My best friend died of cancer. A month later her boyfriend messaged me saying he just needed a friend. I went over that night to his place. I regret ever doing that. He drugged and raped me. The next morning he threatened me. Told me if I didn't keep giving him what he wanted he would kill me and himself. I was terrified. 

For 2 months every day I let him bias and rape me. Out of fear. I eventually started to get myself so drunk I'd just pass out. 

I'd wake up bloody and bruised. He'd wake up ready to do it all over again. 

I'm now so fucked in the head from this experience I find myself missing him. I hate these thoughts. They never go away. I don't want to think this way anymore. I've tried everything. Nothing works. 

I want to die so I can never feel this way again. It's been years of feeling this way. The void is calling my name.",1,0,0,0,0
6,"It's important that people know this when they claim platitudes about 'getting support' and 'healing' that require a stable home, friends, family or even relationships. I spent all of that time trying to get to this point by myself just so some selfish POS could slap me down again. I hate this. I posted this on twitter because I couldn't think and I just wanted to share something even anonymously, of course I got nothing. It's hard to admit sometimes, until you're desperate, but I wanted someone to care.",0,0,1,0,0
7,"My bond about was about 100 less than my whole savings. First place I went after getting out of jail was my work, my boss told me if I had got out 2 days earlier I would still have my job. I'm about to do something stupid out of frustration and anger. I was so close to getting off the streets. Fuckkk",0,1,0,0,0
8,"I am quite introverted and the broken friendship I had with my previous roommate made me feel very anxious, so I moved into an apartment on my own. I love living alone, but when I have severe anxiety attacks it becomes lonely and almost unbearable. I sometimes think so much that it feels like I am going crazy. I have terrifying thoughts and I make up scenarios in which I have some terrible condition, or I am dying. My parents know that I have anxiety, but never took it too seriously.",0,0,1,0,0
9,"I just feel like something put there is telling me to kill myself. It just keeps throwing shit out me till I give up. I think I can finally take a breather. And then theres something else to stress about. This time, I was about to be late on rent. But I did all I could to get the money together. (I'm not even gonna say all the things I did to get the money) but then. I just got off work. And I was about to swing by the bank to withdraw the money to lay rent. But then my car wouldn't start. And I'm completely alone in this state. So I had to call someone to come out and jump me. But it wouldn't jump. So I had to spend money to get it towed. Then the damn mechanic shop jerked me around, and ended up fighting with them alot ( I use to be a mechanic so I know when I'm getting jerked around) but they were so incompetent, that it took them 6 hours to basically figure out that the battery needed to be replaced and then do it. They lied to me when they told me the tested the battery when they first pulled it in the bay. They put a new starter on, without telling me until after the fact. And then told me my engine was seized up due to there being 0 oil in it. Which I dont know if I believe, because I just got my oil changed about a week and a half ago. And I know I dont have a leak. So either they were lying or the technician at the luge shop didnt put oil back in my car. But anyway, long story short. They forced me to pay 600$ for basically a battery change. And then I had to go back to work 2 hours later, with no sleep since my last shift. So that was great. But that 600$ was going to be for my rent. No I dont have any money. And I'm not sure what I'm going to do. I think I've finally reached my breaking point.",0,1,0,0,0
10,"They discharged me. I told a nurse at a health clinic though, where I got sutured, that I just can't deal with the PTSD anymore, and I feel awful on this injection of flupentixol. I'm suicidal. I'm suicidal, and I keep thinking I should just go through with it this time. But this is a cry for help: what should I do?",0,0,0,1,0
11,"Now its personal so it hurts a lot more. There are nightmares where I am murdered, those don't hurt half as much as these. I woke up a few nights ago screaming because of it and I cried like an idiot until I realized it wasn't real. Figured I'd rant here instead of breaking my hands on my heavy bag. You guys ever get extremely worried about your partners safety to the point where it triggers you?",0,0,0,0,1
12,"I was terrified and scared and couldn't get away. She just said he was ""joking around"" but it was horrible. I get a sting of panic and fear if anyone pinches me today. I can't even use a lighter without fear of it (Fire is fine, it's Just that kind of lighters). I also panic if anybody raises their voice or sounds angry.",1,0,0,0,0
13,"She was already against smoking weed after college at first but now she seems to have moved to a stance where she's okay with me smoking weed as long as she's there when it happens, as in I could smoke with just her or when we're both hanging out with the same friends. I've tried asking her about it and genuinely understanding why she feels this way about it but she can't seem to describe it rationally, saying that it's a gut feeling that she gets that legitimately bothers her and gives her anxiety. She seemed very distressed talking about it and was almost at the poiint of tears saying that she wishes she knew why it bothers her so much but it does and she can't help it no matter how much she thinks about it or how much I try to explain it to her. I don't know how to explain this to her. I don't want to give up the option of smoking weed with friends but I don't want to break up with her over something like this because I love her.",0,0,1,0,0
14,"The thought of leaving my folks behind would definitely not be good for me mentally. I've thought about basically living out of my car, gym memberships to shower daily and laundromats to wash my clothes. Perhaps put all my stuff in storage and just keep working and save some money up. I live on long Island btw. Rent isn't cheap.",0,1,0,0,0
15,"This is the first time that i'm opening up about this, so please be kind. I'm from India - stereotypically known as the land of doctors and engineers. And while that's just a stereotype, my studies give me anxiety. I had my first attack two years ago - and I have been talking to people since then - but my recent graduation exams have left me worse then ever. What i want to know is, when was your first attack and how are you doing now?",0,1,0,0,0
16,"I have PTSD from my sexual abuse, and this week has been really hard. Really, since Dr. Ford came out against kavanaugh and the fallout of it. Today, though, was really hard. I come home to see my father watching fox news and agreeing that Dr. Ford is a lying whore. His words.",1,0,0,0,0
17,"Ive been really depressed lately... My math subject at school failed, i keep thinking i wont graduate, i have no energy to go to school anymore so i fake everything and go to a nearby computer cafe even though i only have enough money to commute to my school. I know lifes hard but theres something in my brain that broke... Im not crazy though just uncaring. But i noticed i suddenly grew an interest on one of our kitchen knives, not like to hurt people, its just an odd interest where you imagine the knife killing you painlessly.
But the thing is, i have a phobia of sharp things so i grew up cautious with sharp objects including knives... Its not really bad, i just do stabbing motions on myself, but the point is i consider doing that normal.
I also keep daydreaming while walking and oddly enough i daydream about me getting in a car crash or something similar, which i has a high chance of happening considering im daydreaming. Another point is my fake laughter, i dont know why i keep doing it. I know im probably mentally ill but i have no why of knowing since psychiatrists and therapists costs very much in my country. Anyway im just rambling about my problems but i have a feeling itll all end soon. Just a feeling...",0,1,0,0,0
18,"Just smile : I tried my best today , the whole family and friends were there . I tried . But I could fill my lips opening and start crying wanting to just end the moment . I cant feel happiness . There goes another year me not being myself , hiding who i am from everyone . 

My sister got her friends and went partying , i was keft behind asked by family "" why aren't you going with them "" .

I got the car , i failed everything , from opening the lights to fucking turning the wheels . 

You know how you wish no one is alone tonight ? I really wish no one is alone every night . But we are , lots of us . 

Nothing new here , i cant get out of bed and blah blah blah . We know fucking piece of shit . Why the fuck i am important to me ?",0,0,1,0,0
19,"My mom then hit me with the newspaper and it shocked me that she would do this, she knows I don't like play hitting, smacking, striking, hitting or violence of any sort on my person. Do I send out this vibe asking for it from the universe? Then yesterday I decided to take my friend to go help another ""friend"" move to a new place. While we were driving the friend we are moving strikes me on my shoulder. And I address it immediately because this is the 4th time I have told him not to do these things, then my other friend who is driving nearly gets into an collision with another car i think because he was high on marijuana and the friend we are moving in the backseat is like ""you have to understand I was just trying to get your attention"" you know the thing 5 year olds do to get peoples attention by smacking them, this guy is in his 60's.",1,0,1,0,0
20,"I'm curious, does anyone know of any programs that provide temporary housing assistance if you have a job? I'm almost broke right now. I really don't want to live out of my car or the shelter while working. Having a comfortable supportive place until I can get my first couple of paychecks would be amazing. I'm worried that my current living situation will ruin my chances to succeed with this job.",0,1,0,0,0
21,"I self harm sometimes too. I’ve also lately begun to have constant, daily, and explicit nightmares about tarantulas, roaches, and beetles crawling over me while I’m paralyzed. I don’t know it’s that’s relevant or anything, but it may be good to add anyways. I’m asking bc I don’t want the therapist to yell at me or call me a liar like the last few did, so I’m low key nervous and I don’t want to get in any more trouble with my school. Any thoughts or criticisms are welcome.",1,0,0,0,0
22,I started to hurt myself when i was 14 i am 15 now and i have no idea what to do. I am only happy when i am with my girlfriend who is in the same class.,0,0,0,0,1
23,It did hurt but didn’t leave any marks. When I lied down I kept coughing and today it feels kinda constricted like there’s a lump in my throat. I’ve googled and realised how serious it can be and now I’m terrified but scared to go doctor. What do I do I’m not calling police and I am not going to any hospital. I will go to doctor if they are sensitive about it,0,0,0,1,0
24,"I have been a chronic sufferer of gad all my life. Thanks to klonopin my worries symptons anxieties were gone. But now, the side effects of overdosing on it (which I dont understand cause I only take 2 a day maybe its because my inept doctor upped the dose from 0.5mg to 1) has made my emotions go haywire.

I'm constantly euphoric, spontaneous feeling of deep rage and an impulse to punch and scream. On top of that, being ticked off by little things and become explosive. 

If the price to pay to not feel worried all the time is explosive behaviour Id rather take the other. I have recurred to smoking to calm myself. Right now Im a step away of losing control over and really lose myself go in a blind beastly rage. 

Since I cant see my inept doctor (the only doctor i can afford) till last day of march. I decided to cut down the pill to one dose a day and Im cosidering splittling the dose myself to see if their are improvements.",0,0,0,1,0
25,"All of this has made me feel really horrible. It has destroyed my self esteem and made me feel depressed, unlovable, worthless, responsible, etc. It has also had severe and debilitating impacts on my mental and physical health.",0,0,0,0,1
26,"It’s almost a 50/50 mindset, because on one hand she wouldn’t ever wish to be thought of or treated in a horrid way, I have corrected it best I can, and she is the kind of person to forgive and forget. It’s hard. It’s real hard to decide what to do. So that’s why I’m here today people of Reddit. I realize this isn’t the most pressing, serious, or dramatic post on here, but I stick my hand out in the hopes you can give me some guidance, some past experience, wisdom, or advice on what I can do or try so that the “here and now” are in question, and not “then and there”, so that my confession can go along without regret.",0,0,0,0,1
27,"It helps with the physical symptoms, such as palpatations and elevated heart rate. However I still have attacks that force me to lay down alone for 30 minutes or more, sometimes hours. I have random pains all the time, my arm, leg, chest, stomach, headaches, etc. Constant health anxiety too, I get one mild headache and think I have meningitis or a brain tumor, etc. Well I had a checkup with him today and asked him about medicine I could use PRN.",0,0,0,1,0
28,"But she says she can't stand hearing it because she's got enough on her plate as she actually suffers with depression herself. I do read other people's posts and think maybe I've actually had it easy. Maybe I'm just over exaggerating thing, but i feel like I need to get it off my chest. Anyway thanks for reading. ( sorry the post is so long ).",0,0,0,0,1
29,"Worse than that develop the same anxiety disorder. Again another reason to finish the relationship. I really love her but cannot and WILL NOT embarrass her like I did at the wedding. My plan is to go talk to a private physiatrist and see what they think. I don’t believe medication is the only answer but if it helps in conjunction with therapy, a healthy lifestyle and meditation then I will try it.",0,0,1,0,0
30,"Recently my anxiety has gotten really bad, possibly the worse it has ever been and I’ve been experiencing panic attacks, but I still can’t justify taking my medication because I feel like I deserve to suffer. I also struggle with the feeling like I’m making all this up and none of my problems exist which I know rationally cannot be true when I’ve struggled with this for most my life, however I still can’t shift it. I don’t know if this is part of my anxiety making me feel like this or whether it is another thing I’ve made myself believe. I guess I’m just looking for some advice and reassurance. I’m just really tired of feeling this way and constantly being in turmoil with my mind.",0,0,0,1,0
31,I know it's not much but as a student living on his own for the first time and being diagnosed with anxiety and depression (I haven't gone out in more than a week) actually getting out of bed to do something feels like an accomplishment as I would normally starve in my bed wondering why I even exist in the first place.,0,1,0,0,0
32,"Through everything, I just froze and waited for it all to be over. Each time I petitioned her to stop, she would become very visible distressed. She spent a lot of time talking about suicide. During the school year, we exchanged letters every day at school that, in retrospect, sounded a lot like love letters from her part, but I chalked it up to a best friend love. I'd never been in a romantic relationship- I was 13 at that point, and didn't really know what that looked like anyway.",0,0,1,0,0
33,"When it's abuse in the workplace, it seems like everyone just says, ""Oh, get over it, and don't be a baby. There's nothing wrong with you."" I actually had one women tell me that my husband's behavior was 'completely normal' and that 'everyone acts like that' (I was floored. I don't know one other person who goes through shit like this at work or who acts like that - WTF?). They just want to brush it off, and no one gives a shit.",1,1,0,0,0
34,"I only get it when I have a flashback or strong reaction to a trigger. I notice it sticks around even when I feel emotionally calm and can stick around for a long time after the trigger, like days or weeks. It’s a new symptom I think. Also been having lots of nightmares again recently. Not sure what to do as I’m not currently in therapy, but I am waiting to be seen at a mental health clinic.",0,0,0,0,1
35,I want to know if people do to snap me out of my mental state in some way. I tried to commit suicide two weeks ago..,0,0,0,0,1
36,"Sorry for such a jumbled mess of a post. Edit: I realize I never expanded on the dissociation or depression. Because of my dissociation, while he was being abusive he would often say things like, ""You're just remembering wrong. (gaslighting/rewriting history)"" ""You have bad memory. That never happened.""",1,0,1,0,0
37,"I barely slept in the hospital because I stayed up at night and listened for codes with his room number. I was terrified, constantly living in fear from the moment I awoke until about his 7th day in the hospital when he seemed clearer, and sat up with assistance for the first time. Fast forward to now. We are lucky to be alive, and we are injured. We’ve been robbed of a normal engagement, of the experience of moving in together, and that’s a grieving process...but my mind...is not what it was.",0,0,0,1,1
38,He loves them and treats them like gold. I love the type of father he is but I hate the way he treats me. I have no one to open up to or go to if I even tried to leave him. I’m tired of him abusing me mentally and physically me. He has cheated on me several times and each time it knocks my self esteem Lower and lower.,1,0,1,0,0
39,"I have been through a very hard life, from my single parent mother being addicted to drugs, being in Foster care for 7 years, to being homeless for 6 years. I have and had finally gotten myself where I needed to be. I got a puppy I love dearly and has been my Emotional Support animal. I do everything in life for him now. I finally got my own place after 4 years. I have a great job that I am happy to go to and I can afford to pay my bills and all of my habits/ needs. Today I got a notice to vacat after spending months fighting over Landlord Obligations. I lost my old job a month ago because of the emotional distress that I was in. I literally told my manager ""How can i care about someones remote not working and sit with all sincerity to trouble shoot, and I go home everyday to no heat and my dog shaking uncontrollable, but keeps a smile on his face for me?"" I was unable to pay my electric bill, so they are trying to evict me on the premise of breaking the lease. All of this is breaking my faith. I am trying so hard, but everytime I get a head there's something trying to break me. Today I have fallen back into my depression and cant help but say it's better to give my pup away to someone more stable and kill myself. I cant keep going and dealing with uncertainty or being homeless. I try so hard everyday, to just get pushed back into the void. It took me losing myself and being at the end and seeing the darkness as a comfort, for me to get to where I am now. Yet, it seems life wants me to go back there. I am numb and ready.",0,1,0,0,0
40,My suicidal thoughts have gone from not serious to something I fantasize about. It actually makes me feel better to think about it because I want it so bad. I'm just to big of a pussy to actually do it. Anyone's 2 cents is valuable to me. Have a happy moment today :),0,0,0,0,1
41,She thinks instead I should ask if I can read him how it has impacted me since this has happened. I don't know what to do. It's coming up so quickly and I'm feeling a twinge of anxiety as it gets closer. I keep telling myself I did everything I possibly could and that I should do what feels right to me even if it means I may feel like I'm going backwards at times. I also have to make a decision on if I want a permanent restraining order or a non violent contact order.,1,0,1,0,0
42,"If you are triggered stop reading but the word is schizophrenia. Just thinking about it freaks me out atm. I keep thinking I will go crazy.... I imagine myself in a mental hospital having panic attacks 24/7 a hellish torture... oh god.... This is because I've always has extreme fear of afterlife and existence, its just so bizarre I've explored every single freaking theory/religion/whatever thats how much I was obsessed with it before.",0,0,0,0,1
43,"We ate and he was monitoring my data use because I sent some photos to our friend of her baby shower. And he said he ""hates having to watch over me like a father and he wishes I was more responsible"" but said that he ""accepts that this is the way I am"" I said nothing in response to this and just ate my food and let it slide, smiled at him and small talked. We got back to the park and they had put out a new sign saying they were closed for the rest of the day. This made him even more mad.",1,0,1,0,0
44,"I grew up my country’s equivalent of the bible belt. My country is well known for being very very progressive in our larger cities, and very very conservative in our villages – this is true I think for most countries, but the sheer difference between our “levels” is pretty well known. I grew up in an abusive household, surrounded by really misogynist men, and have experienced trauma on both these fronts. This obviously caused me some mental health issues. I was afraid of, and uncomfortable around, men for a very long time.",1,0,0,0,0
