,text,Bias/Abuse,Finance/Career,Relationship,Health Concerns,None of them
93,"I desperately miss my childhood and I wish I could have it back. After being molested, I feel that it was cut short. I'm afraid of getting older, and getting to the age where l have less time left than I've already lived. I think about it every day and it consumes me entirely. I'm obsessed with extending my lifespan on one end, and just killing myself on the other",1,0,0,0,1
94,I even pressed chargers against him. Unfortunately he still found a way through to me by hooking up with girls that I know and having them make sure I knew about it. Nothing has happened since June and I’m about to be moving far away from him. I struggle with what he did to me every day and the flashbacks occur still. I don’t expect this to ever fully go away but I am 18 now and I can say that I survived this.,1,0,0,0,0
95,"Hello. As you can tell by the title, I'm concerned about this little girl across the street. She's able to walk and talk, but I don't think she's even 5 yet. From what I've witnessed the four years I've lived in this house, the home she lives in is not at all suitable for her as a developing child. Her parents are constantly screaming at each other in the street, and the girl is bawling, as her mom commands her to get into her car so she can take her wherever.",0,0,0,0,1
96,"One second I’m thinking, things are just fine. The next I’m thinking, I’m awful for prolonging this, just do it. It’s exhausting. I know I need a bit of a break for some me time at the very least, but beyond that I can’t tell what’s real and what anxiety. What do I do?",0,0,0,0,1
97,"I'm just venting into the void because I feel bad for constantly annoying my friends but I has an epiphany 20 minutes ago that like...yeah I'm absolutely going to die single and unloved. I have friends and family but literally no one wants me romantically. All I attract are toxic folks that just suck the energy out of me. I just had to cut things off with this guy I was really into because I realized he just used me and didn't care about me but now I'm like maybe I should just stick with him but at least I can pretend he cares about me. Or at least wants to fuck me. That's probably the best I can get. 
I'm never going to have a healthy romantic relationship and I'm gonna learn to accept that but for tonight...I cry. 
I'm just too ugly. Not interesting enough. Not funny enough. Not thin enough. My ass isn't fat enough. Waist aint small enough. Not smart enough. 

But hey in a few years I'll have a kid on my own and I'll pour all the love I never had into the lil human so they don't end up like me. Broken and unlovable. 


I'm spiraling.",0,0,1,0,0
98,Happy new year : Fuck 2019...2020 will be bettexaxaxaxaxaxa why do i even have to be happy because earth did a whole circle around sun nothing will cange fuck my life hope u all have a better year that me...not better like just the opposite mine will be miserable sad and useless i know it. happy new year,0,0,0,0,1
99,He causes emotional pain to me every day but I cannot get myself to leave him. He physically abuses me sometimes but it rarely leaves a mark or bruise. I feel like even if he cheats on me (again) I still won’t want to leave him. The only way I think I will leave him forever is if I end up hating him. And the only way I will hate him is if he caused physical harm that I cannot lie my way out of like I have in the past.,1,0,1,0,0
100,"I apologized for taking up too much of his time and space and for not respecting his boundaries, and for storming off angry; the worst part is that he eventually said he didn't accept my apology because I was still ruining his day with my insistence he apologize for speaking to me with a ""retarded"" voice. So, is our relationship doomed?   ---   **tl;dr**: My bf and I fight too much, and I think it's both our faults while he thinks it's only mine/my brain chemistry's fault. Am I crazy, or do we need to break up?",0,0,1,0,0
101,"But what do I know? I keep reassuring myself that this is normal, and never tell anyone about this - I'm surprising one of the top students at a selective high school, but I really want this to end. I'm good at hiding things like this, because I don't want others feeling pity for me for things they didn't cause or can change.   ---   **tl;dr**: Older brother psychologically and physically abuses me and my younger brother.",1,0,0,0,0
102,"Who do I talk to at this point, the Command Equal Opportunity Officer (e-7) who basically says she will look into it but doesn't seem concerned. There is a stigma about asking for help in the Navy and it needs to change. Basically, if you take any meds you get treated like a black sheep. If you go to medical and they give you meds, you get removed from your duties and everyone else carries your load while you are forced to stand around them not allowed to do anything. If you do get out of the navy because you spoke out about being depressed, anxious, or having symptoms of PTSD then you would be seperated from the Navy and sent home.",1,0,0,1,0
103,My therapist says this is a normal behavior to display. Having been ripped from my children and left on the streets is very hard and i honeslty want to give up. But the anxiety swirls to the point i keep trying to find where i went wrong. It replays and plays in my head over and over like a horror movie. The feeling of wanting to die because at that point i had nothing left.,0,1,1,0,0
104,I don't even know that I feel lonely. I was fine with all this until my boyfriend asked out of concern because he thought maybe I was depressed or something and pushing everyone away. Then it was like he knocked down a wall inside me that I didn't know was there and revealed a whole room full of cobwebs. I feel ashamed and defective and hopeless now. But I don't know what to do.,0,0,1,0,0
105,"I feel like I am in a pit that I cannot escape from. I know that I am anxious all the time and terrified of fucking up and I know for sure that the more anxious I am, the more I cannot focus well and think straight and the more likely it is for me to fuck up .. and somehow, everytime I do, I feel like I just want to belittle myself so much that I deliberately and purposefully want to see myself covered in blood and bruises because I feel like I deserve it! ! EDIT 2 ..",0,0,0,0,1
106,"But it seems like I'm also dealing with abandonment issues with my parents which has recently reemerged after coming out as transgender which they don't support. Unfortunately, I have Lyme disease and live with them because I'm too sick to do anything and they won't support my transition. I get the feeling that if I was healthy and I transitioned I'd never speak to them. I was reminded of PTSD from a comment on r/raisedbynarcissists/ and Borderline Personality Disorder was brought up. I don't know if it's a secondary condition or overlapping symptoms, but C-PTSD specifically was mentioned and that seems pretty accurate.",0,0,1,1,0
107,"If I have time to think then all I want to do is commit suicide. 
If I watch movies or play games or something similar that is not boring to me I am fine. My problem is at work it's an 8hr suicide thinking session",0,1,0,0,0
108,"Now like I said, I am working hard to try and get a better job while balancing school (the good grades I've gotten in the past year and a half seem to be only things I have going for me right now. That and martial arts) and at the same time, I'm considering asking for another shift at my current job as an absolute last resort. But this anger and feeling like a loser is really something I need help dealing with. Tl;dr: My car died once and for all a few months back and my job sucks. And even though I'm working hard to improve the situation, I feel angry and I feel a like a loser.",0,1,0,0,0
109,"Last week I posted about having to travel to Melbourne with my Sister who is a really nasty person, well it ended up being exactly what I feared, she was just plain nasty to me the entire 3 days. From the moment we arrived at out rented apartment, she would just do nothing but complain about me, saying that I'm so ""over dramatic"" and that ""I'm just anxious for attention"".......I mean really? I never wanted to be like this, and she has the way of making me feel like I'm a bad and worthless person. Now I will admit she has issues of her own, she has been pregnant so I can excuse her for that, but she has been like this for a few years now, I remember how I was anxious about my elbow swelling up and she said it was ""nothing"" and it turned out to be cellulitis. Ever since I came back from Melbourne, I've just been overthinking things, and when I do, it flares the anxiety right up.",0,0,1,0,0
110,"She told me she had one more person to interview and that she would get back to me by Monday. I shook her hand and rushed out the store to another place and went to their restroom. I ruined my hair, I popped a little of my collar and unbuttoned some of my dress shirts. I added some water stains and even took advantage of a partially full cup of soda in one of the stalls. I spilled it on the rims of my shirt but not entirely.",0,0,0,0,1
111,"You can see the detail on my [update 2 right <url> and here's a link to the [project github <url> So I'm begging you here, literally begging you. If there's anyone out there who would be kind enough to give me a second chance to fix my fuck up and finish my degree, would you please consider giving me some financial aid via [my goFundMe <url> I'm literally in dire need of help right here and I don't know where else to turn other than the people of the internet :( ***Kind regards,",0,1,0,0,0
112,I feel like I am at my wit's end. I have been looking for a job for almost three months now and have been unsuccessful. I struggling to pay my car and insurance and just regular bills. I am in school and living in a bad environment. I am trying so hard applying and going on interview after interview and nothing is working. I dont want to do this anymore I dont want life anymore. I dont want to live I feel like I can breathe I feel like theres no point. I feel like I am drowning. I want to just stop waking up,0,1,0,0,0
113,"I have almost constant health anxiety. It's a mixture of agoraphobia and health anxiety. I'm afraid of having some incurable disease or suddenly stopping breathing... I've been kinda iffy the past few days, just tired from lack of sleep, and I usually feel like shit after my period which triggers my anxiety. Well anyway I went out to meet my mom for some food and the first thing she says to me is ""wow are you okay?""",0,0,0,1,0
114,I mean I'm going to live in my parents basement until I die so what does it matter if I'm gay or straight. Not like I'll actually do anything about it.,0,1,0,0,0
115,Death of my father : My father died in the beginning of December. While he was not a great father he was the only person I felt I could even talk to. I was extremely upset but later on found out that he apparently never told his own brother that we existed. Everyday I am either angry or upset. I feel so alone and being around my mother is worse who constantly talks over me or criticizes me. There is nothing positive in my life at the moment. The only thing that keeps me going is my dog or reading.,1,0,1,0,1
116,"<url> Hello, I'm a 34 year old Transgender woman trying to survive in Montana of all places. I not only have to fight gender dysphoria but also try to stay strong living in a community in which many openly hate people like me. I am trying to reach my goal of Facial Feminization Surgery, as well as Gender Confirmation Surgery (Bottom surgery) and Breast Augmentation with the first two being my main goals by far. I feel intense pressure to get these things done as soon as possible.",1,0,0,0,0
117,"Leaving was one of the hardest things I had ever had to do. My parents really disagreed with me taking time off from school, so as fall came, they spent every day trying to get me to go see if I could come back in the spring, and to get a job. Now job has always been a scary word for me, because my only job I've had is teaching people how to hit things beautifully (Percussion Private Lessons). I had come so close to interviews in the past, but I could never get myself to leave as the day came. This lead to my parents becoming more and more frustrated, and the only person I could seek refuge with, was Sarah.",0,1,1,0,0
118,"If they weren't done he would get angry at her. After that he would borrow money from her while he was making a lot of money. Instead of paying her back, he would spend both his income and her money on things he wanted. The next thing was that he would say things like ""I'll do this for you but you'll owe me a blow job later."" While that worried me the next sign really made me concerned.",0,0,0,0,1
119,"I come from and live in a country where things are too hard and over half the population is unemployed and suffering mentally. The only people surviving are doing something illegal like pulling the most scams, kidnapping or prostitution. I wish I can indulge in any of this, I have tried to do everything legally even with a degree i seem not to find a job.

It is too hard for me to live on, I can't afford basic meal or rent and this hardship has set even my family apart.

I am thinking of taking my life as the problem persist. See you guys on the other side if ever succeed.",0,1,0,0,0
120,"I didn't want any of this.. I literally had NO CHOICE in ANY of this!!! If I didn't have kids I would not be here, 100%. I pray every night that I would just die in my sleep... then LOL no sleep, no death, just lots of screaming in my head and ruminating anxious thoughts, bad memories on top of bad memories. THIS is hell.",0,0,0,0,1
121,"I want to be able to deal with these feelings and move on. I’ve talked briefly to a counsellor on the phone but besides talking about it making me cry, it hasn’t made me feel better. This is one of the worst PTSD episodes of my life. I can’t predict how long this is going to go on and I’m sick of the weak, dissolving feeling I get whenever I think about it. I’ve been trying to replace bad thoughts with good, I’ve tried CBT techniques, I’ve tried wallowing in the bad thoughts (as advised by someone over at r/emetophobia)... nothing has worked, I’m a mess.",0,0,0,0,1
122,"This is so hard to write about for me. Attempting to describe what I've been through cuts me really deep down and spins me through flashes of pain, tears, and the deepest depression. I really feel kicked when I'm already down. So please, forgive me for the winded intro and shaking writing style. It has honestly taken me a week just to get to this point.",0,0,0,0,1
123,He wouldn't take me to the hospital but I could feel the gaping wound in the back of my head and the hole in my lip my tooth had done. He kept packing. So I called the police. I couldn't see out of my left eye and clearly couldn't drive and felt I had no other option. The police department chose not to press charges.,0,0,0,1,0
124,"Certain things will make me feel uncomfortable. as of recently she will jokingly play with my nipples, like suck on them or biting them if we are laying in bed and I’m shirtless. This makes very uncomfortable and I don’t like it at all. I’ll laugh and tell her to stop and that I don’t like the feeling of it. She will keep jokingly doing so and tell me stop being a baby or that she is just joking around.",0,0,1,0,0
125,"I'm a 23 year old unemployed woman still living with my mom. I quit my job 3 months ago because of the stress and anxiety it was putting me through. Of late my mental health has worsened a lot and I can't seem to get out of the loop. Everything makes me cry and I don't even feel like going out of my room most days. I go to a psychiatrist and I am on meds but nothing seems to be working. (Ive changed almost 7 therapists/psychiatrists now because my mental health was showing no improvement.) I feel like a parasite, latching on to my mother and aunts for financial support. I want to move out and live independently but I don't even feel anything. I don't feel like doing anything, let alone wanting to work. I constantly worry whether I'm just being lazy and making excuses or whether I genuinely have a problem. I don't want to face people, give interviews or work among other people. Everytime I get a job I end up having panic attacks and excessively stressing out. The thought of having responsibility and knowing that there are certain expectations I have to meet while working, and the constant anxiety of doing badly at my job trouble me so much. I don't want to go through any of this. I don't want to. I don't want to do anything. I'm tired of being taunted by everyone and having to dodge questions about why I'm still unemployed. I feel useless and worthless and I don't know how to get out of this cycle.",0,1,0,0,0
126,"I have an appointment with a paralegal to draw up a separation agreement. When I tell him I want and am filing for a separation and divorce, he will ask why. Do I mention to him about finding the extent of their chats and the cellphone bills? What about the disappearing IM accounts? Or do I just leave it at ""You had an affair, you aren't being completely honest with me about it, I feel like this 'reconciliation' we are experiencing is just me being strung along till you get your pieces in place to leave.",0,0,1,0,0
127,"I know I should tell her my doubts, because I know she's gone through doubts before as well. But I also don't know if now I'm just second guessing because I'm just generally concerned about the future. Above all I just have no idea what to do.   ---   **tl;dr**: living long distance, dealing with chronic wedding anxiety and fear about impact of children, fantasizing about others, and hoping for insight from people who have been through similar experiences.",0,0,1,0,1
128,"“The best years of your life” : Cant shake the feeling that this new year signifies another year failing at school, working a shitty job that I hate to pay for it, having no friends and living at home with very indifferent parents. These are my 20s, the “best years of my life” and I’ve been closer now to killing myself this past tear than ever before. Earlier tonight I wished for the courage to kill myself before 2020 was over. If I were to tell this to anyone they would probably just tell me to “look on the bright side” and “make your life what you want it to be”, both phrases are completely unhelpful and seem to shift the blame on me for being unhappy. I just want to know how y’all plan to survive 2020? Honestly getting pretty used to the idea of riding out in a hearse  before 2021.",1,1,1,0,0
129,"Without my meds I can be kinda unstable, few months back I stopped taking them and ended up breaking my hand because of it. I have no real education except high school diploma and I wasn't smart enough to finish community college as I'm useless with math and science and that's all I needed to finish for a general studies degree. All I seem to be doing is existing and that means I'm a burden on anyone who tries to help me and right now I'm dragging my partner down. I just need help figuring out what to do so I can stop being burdensome and be useful and have a purpose again. I don't really know what to do anymore, but this is all I have left to try.",0,1,1,0,0
130,"First off, I want to apologize for posting here so often. I don't have anywhere else to turn to. I recently contacted my abuser. I don't know why, I think it's part of my self destructive behavior. And I've realized something.",1,0,0,0,0
131,"When first diagnosed I was put on a daily prozac. 3 years later, I've managed to wean myself off and just use my klonopin only for the worst attacks. That actually seemed to work well and I've been off the prozac for about a year and even got off Facebook 3 months ago because it was becoming a point of unneeded drama, but I'm suddenly getting the depression symptoms again. I've walled myself off from most people and have become less communicative with my husband. I don't like going to our neighbors house because I have a paranoia that 2 of them don't like me.",0,0,1,0,0
132,"I don't feel like eating, sleeping, working, playing games, etc. All my friend's do is harass and bully me so they're no help. I just wish life would go on without me",1,0,0,0,0
133,"Hi r/domestic violence! You guys were recommended by the super supportive guys over at r/twoXchromosomes where I made this post earlier in the week: <url> (tl;dr: I've been facing a lot of personal strife lately, argument on Saturday with my husband resulted in restraining and a hit to the face. We're both military members.) A few things have happened since last Saturday.",1,0,1,0,0
134,"throwaway... sorry if this all sounds very messy. I have a history of child sexual abuse, rape in a past relationship and problems with dissociation. So I was feeling like a robot that day again, due to stress. I then went to my boyfriend. I told him I am dealing with that again, he knows about my problems.",1,0,0,0,0
135,A few years ago I witnessed an accident at this time of year and I am beginning to remember it again. At night I hear the sound and burst into tears and calm down until I hear it again and start crying. I didn’t know the person involved but I was one of the closest to it when it happened but I’m beginning to sort of enjoy the release from crying and fantasize about telling people about it. I feel guilty for this indulgence and feel like maybe I am just looking for attention. I have always had bad anxiety and mild depression so is it just that?,0,0,0,0,1
136,"I'm starting to really believe that my brain is the problem here and not trauma. Everyone just thinks I'm a dramatic slut anyway, so does it even matter? Like maybe they are right? I feel like I'm too embarrassed to even go back to my psych now. Today I seriously looked like a total basket case.",1,0,1,0,0
137,I think I get misinterpreted a lot. I don't feel good. I'm selfish but I need validation too. My things matter but so do yours. I just need to find the right meds.,1,0,0,0,0
138,"I've been trying to act like nothing happened but I can't stop thinking about all this. I feel weird that i'm even thinking about it so much. I should just brush it off. Everyone keeps telling me I should go for it. Even my guy friends, which I assumed would agree with me feeling gross about all this.",0,0,1,0,0
139,"as I was getting ready for an interview for a new job, i was thinking ""what if i kill myself? wouldn't that be easier?"". I've never been diagnosed with depression or even anxiety because... I've never told doctors about it, about what I'm feeling and thinking, etc. so I don't want to kind of self diagnosed myself as depressed while there is people out there who has been and theirs may be more severe than mine. but... there's period where i constantly feel bad about myself and I just want to end it all.
I just want to know if some of you here feel that way sometimes (or everytime), and how do you live with it? is ever going to change?
(also, sorry I'm French so my english isn't perfect...)",0,1,0,0,0
140,"I've been crying almost every night for almost 2 months now. At first it hurt my eyes from crying so hard but not anymore, now I just feel sick when I cry, I just want a week where I don't feel like crying",0,0,0,0,1
141,"I would be lying if I said using heroin didn’t get more tempting everyday. Atleast I could either slowly die high and numb, or accidentally high and numb. I feel like I’ve had a noose tied around my neck sense the first day my incest abuse happened 14 years ago. Ever sense I was 9 or 10 I knew I would die by my own hand. It’s only a matter of time.",1,0,0,0,0
142,"I feel like I will never trust my own judgement again. 3) I fucking HATE being this person. I hate being a victim. I would never judge anyone else in my situation, but I can’t stand having to see myself as someone who was abused. My grandfather abused my grandmother her whole marriage and I always felt like, because of that, I would always be on the lookout.",1,0,0,0,0
143,"In a shame spiral, validation after asking feedback from peers, I'm over-reacting or too sensitive. Thank god my GF still loves me. I am in states of hypervigilance, catastrophizing, and hypersensitivity and it blows. Just needing to write this out, it helps. Thank you for reading.",0,0,1,0,0
144,"He would play really loud music on the speaker. It got so bad when he threw the living room table at me.. we got kicked out of at least 4 apartments. At this point we were homeless. He wouldn’t get a job, and wanted me to get out and hold a sign and pan handle for money, if I didn’t he would drive the car we lived in really fast and say he was going to kill us. He wrecked that car (small wrecks) at least ten times.",1,1,0,0,0
145,"But recently I went on a car journey with my friends and 5 minutes before we got to the destination I started panicking because I thought I needed a wee and took a valium (completely embarrassed myself in-front of my friends). once we got to the destination I was actually fine and didn't really need one that bad. Since then it keeps happening, like I was on the train and 1 stop before my destination I got off and walked because I started panicking. then today really got to me because I needed to get a bus that goes through a tunnel to go to the pub that takes 10 mins and I physically couldn't get on the bus because of this fear. I'm so annoyed at myself that this is starting to control my life.",0,0,0,1,0
