,text,Bias/Abuse,Finance/Career,Relationship,Health Concerns,None of them
199,One of the couples has a four-year-old daughter. We live in a two bedroom apartment. I constantly have to do shit for these people. One of the wives scolds me  constantly and tells me I need to show more respect for my parents. They leave needles out everywhere and when I inevitably step on one I'll probably end up with an STD.,1,0,1,0,0
200,"I was cleaning my house with bleach, got a nasty burn in my throat when I woke up the next day. Day later it went away, but the day after that I got the worst body aches, chills, 100.6 fever, and dizziness for 2 days. It all cleared up but I have had this dry cough for 4 days now with no relief, it keeps me up at night, and I go into these coughing fits. What should I Do? I can't see a doctor for 2 more weeks as I am out of town on a job, i think I am a hypocongiract so ii worry a lot lol.",0,0,0,1,0
201,"I had the depo shot for the first time at the beginning of March, decided to not go back for the 2nd because I wasn't a fan. Didn't experience any issues while on it , but once I came off of it, all hell broke loose. My once controlled anxiety became out of control and I had random days where I felt depressed/crying spells. The intrusive thoughts were out of control, and had an anxiety attack the 2nd week of working at my new job. I had to leave work and go home, which hadn't happened in almost half a year.",0,0,0,0,1
202,"Someone else’s suffering ensued. I feel immense sadness and guilt now. I am confronted by the memories and the recognition that to this day the experience became part of who I am. It made me stronger, as facing fear and trauma can do. But I also internalized a sense of profoud fear and vulnerability.",0,0,0,0,1
203,"I feel sick whenever someone praises me, or says anything optimistic directed towards me.

It feels disgusting, as if they're lying to my face. My mind tells me they have to be lying. They *have* to, else everything I've established in my head about myself is destroyed.

Can anyone relate?",1,0,0,0,0
204,"I’m trying to tell myself it’s like being beat up on the street by a stranger - it’s only once, but it still happened and it’s traumatic. 2) Related to the above. It WASN’T a stranger. It was someone I loved and trusted and I can’t believe he could have done this. He never treated me right, not truly (except maybe in the very beginning), but I never even saw this as a possibility.",1,0,1,0,0
205,"My stress tolerance was already at a zero and I was contemplating suicide a lot, i didn’t want to see where that would lead me and I didn’t want to do that to my brothers. I was incredibly lucky and got referred to a good psychologist that I like. He’s helping me through the problems of getting rehabilitation welfare, which is a hassle because I constantly have to talk to new counselors, psychologists and psychiatrists which triggers breakdowns. I hate talking about myself to strangers, I’m not ashamed at all, I just hate having to share how I truly feel with strangers. It makes it so real.",0,0,0,0,1
206,"It all started 2 years ago when on my 15th birthday my friend gifted me a video game called CSGO and I though it was gonna be the best thing ever as I was new to gaming. Then I met a guy from the UK by the name Nukes on steam ( a gaming platform) and he was good friends with me for a year we used to play sometimes and chit chat about csgo trading and stuff. And then my next birthday I decided to buying a $100 steam wallet code with all my saving of past year + birthday money ( its a big deal for me as I dont have a job yet student nor rich) and Nukes told me his ideas and how it would be great if I could send it to him and he could get me profit from trading items in the game ( he was on steam for 3-4 years already) so like any innocent person I went with it. Then it started. Me finding out he lied to me and started blackmailing me, acting racist to me, forcing me to do stuff like shaving my eveybrows and calling his friend the n word on tape if I wanted my money back, I was naive and though if this is how I could get my money back it wont be a big deal. It went on from there, he moved on to asking my socials and always under the pretext one last thing you need to do, I was getting severely cyber bullied and biasd day and night but didn't tell anyone and use to cry everyday at night. He even went on stalk my youtube channel make more false promises, message my real life friends when I tried to block him and lure me back. It has made me really sucidal over the last 2 years and now I can't live with this anymore. I never though like would be this bad and for my lost money I would lose so much more as far as my will to live.",1,0,0,0,0
207,"I am constantly being controlled by my abuser in having to fight his continued harassment in court, or I am controlled by my emotionally abusive husband who I can't leave because I have no money and we have kids together. I am starting to become seriously suicidal. Last year, on my birthday, I made a serious and almost successful attempt on my life because of PTSD triggers that weren't even as bad as these. My birthday is coming up again in February. I don't know what to do.",0,0,1,0,0
208,"And I don't ask for the nightmares to drain me of all energy and make me feel worse throughout the day the harder I try to be normal. I was planning on seeking counselling without my parent's knowledge for this condition once I get to university and get settled, but now I'm wondering if I'm going to be told the same thing by a therapist there. I'm not looking for a diagnosis, just people who share my experience or know what I'm talking about. I'm sorry if this seems kind of ranty or rambling, my thoughts are a bit of a mess and I'm not sure what to think. Thank you for reading all this, anyhow.",0,0,0,0,1
209,"I'm exhausted from just continuing to go to work. God I'm so tired... I know I'm so much further than I was a year ago. But it still sucks. But I know I'm getting happier, I am happy most days.",0,1,0,0,0
210,"3. Since we are both the only child, we both feel an equal responsibility to carry on our family lines, regardless of our own gender. What do you guys think would be an equitable solution to this problem?   ---   **tl;dr**: Girlfriend wants future children to have her last name, but I am not comfortable with that due to social conditioning and/or the backlash I would face from my own parents.",0,0,0,0,1
211,"Everything sets me off and I'm almost having a panic attack. I'm going to my dads soon and that also makes me anxious because I'm afraid that I'm not in the mental state to go there and I want to stay at my moms but he really isn't happy when I do that. Anyway when she complains or is feeling bad I comfort her and I've never raised my voice at her even when frustrated. When she thinks I disagree with her she raises her voice, I have to talk about what she wants to in general right now because she gets impatient easily. I feel like vomiting because she also has so many redeeming factors but I don't want to lose her as a friend.",0,0,1,0,0
212,"That's all I really needed to say, just kind of sick of going all day without being so much as acknowledged by those around me. Hope all y'all are doing ok",1,0,0,0,0
213,"Previously I posted in r/Assistance that I got out of debt reselling stuff... Everything was going very well until I wanted to make an order for things I already got paid for. Accidentally deposited to a phishing site that looked and acted exactly like the original one. Now instead of being 2000 USD in debt, I'm in 12000 USD debt. 

And yesterday was my first suicide attempt... It would be successfull if my dad didn't come early from work. Five more minutes and I'd be dead. I don't know if it's good I didn't die.",0,1,0,0,0
214,Im positive the 2 panic attacks and the following brain fog is anxiety based because like i said I've had mild anxiety in the past and i don't think i have any other issues. Anyways i was wondering if its normal to feel spaced out and a little slow/ tired a few days panic attacks. I haven't touched weed since but i still feel spaced out. Any insight would be appreciated. I also noticed when i don't focus on my worry i feel a little better,0,0,0,0,1
215,"I'm fat, unattractive, unmotivated, and best of all six figures in student loan debt  and not even graduated yet! I'll never be able to afford living on my own so there goes the last little bit of hope for dating, though relationships don't seem great to me anyway. I've fucked up my future lol. I have constant stomach pains and stiff pains everywhere from all the anxiety I feel on 24/7 basis. Also my health is declining as well, so that's fun.",0,1,1,1,0
216,This has made me really question where I am and if I should be staying put. Sort of if where I was was right I wouldn't be feeling like this is now. I'm not thinking I should leave for the sake of being single to see someone else but maybe if I'm not as happy as I thought I should be leaving for me to have some time and space to do things on my own. Any suggestions reddit? **tl;dr my crush on my driving instructor is making me think about leaving my boyfriend**,0,0,1,0,0
217,"i realized i was already 20k in student loan debt and i was not going to waste all that debt on a school that is considered ""lame"". some of the best friends i have ever had were at the school, but i traded them for a lifestyle of drugs, sex and redundancy. This new school was considered a party school, one of the best in the country. Due to my good academic standing at my last university i was able to transfer here. but upon first getting their i had already become homesick and depressed.",0,1,1,1,0
218,"I've never even told anyone this because it makes me feel like a 32-year-old loser. But now I have no pride to lose by saying it, so there it is. **I don't want to die, but the thought of living in a place I hate and having no control of my future is a worse fate. **  I just need some HOPE. Thanks for listening.",0,1,0,0,0
219,"I then joined a few suport groups online, but the same problem happened again. Why this is a problem, is because its my attack trigger, along with other things related to the event like seeing screens smoke, smelling it on people, and other such things. The traumatic event was when I was forced to take it by friends when I was severely ill and could have used a nine-one-one call instead. I did eventually get help, but not after having pot butter and a pipe shoved in my mouth. I wasn't in a good crowd back then.",1,0,0,0,0
220,"with our son - My son is a Daddy's boy. Even now as I type this I hear him out there waiting for me saying Daddy Daddy Daddy. He comes and gives me hugs when I come home and barely notices when my wife is gone or comes home. - ‎This is also something she's recently admitted and I feel guilty about it, but I feel like it's because she puts in no effort beyond what she needs to do.",0,0,1,0,0
221,"Last year was the worst : I have been struggling with a divorce, not seeing my kids, house got foreclosed on on top of a huge pile of debt, and I'm in this hole that I cant seem to get out of.  A few months back I almost shot myself, luckily my dog was there to comfort me. I drink myself to sleep almost every night now even though I tell myself I wont every morning. I have no motivation. Luckily I have a job I like but my home life sucks. I cant even seem to get the energy to watch tv or play video games anymore.

I really hope this year will be better, I haven't lost all hope. I hope everyone's year here will be better. I really just wanted to get this off my chest a bit as I haven't ever really told anyone what's going on with me. Thanks for listening random internet strangers and I genuinely hope we all make this year better for ourselves than the last.",0,1,1,1,0
222,"I know this may seem like a small thing, but to someone with these problems, it's a huge deal and to be at a store where you do not feel ""safe"" around your managers and you can't talk with them and grow as an employee, what's the point of continuing to work there? So I luckily got them to put me on 3rd shift. Minimal contact and I still get to work for the company. As I did mention, I have been struggling lately with some things: being slow with completing tasks on the work list is the biggest issue I believe. I'm not sure why I'm slow, in the past a supervisor has said ""Yes you're slow, but you're thorough.""",0,1,0,0,0
223,"From the moment I wake up and until I go to sleep I don't feel safe. When I'm around other people I feel even even more anxious/fearful. I know nothing bad is going to happen to me, but I still feel this way.  I don't really have any friends, and these intense chronic feelings makes it seem impossible to make a real connection with anyone. That's what I need the most is some sort of real connection with another human being.",0,0,1,0,0
224,"Today's the day to get out of bed! Get off that couch, or get the hell out of that chair, y'all. Start by sitting up wherever you are right this second. 

Right now, I want you to take a deep breath in through your nose, and slowly breathe it out through your mouth. Take another deep breath in, this time focus on the roof of your mouth and your tongue; relax those muscles, let your tongue fall away from the roof of your mouth, and breathe all the way out. Repeat this breathing technique, focusing further on your lungs and your rib cage. Feel each breath slowly touching your nostrils, pulling downward into your chest, filling your lungs. Consider your posture now, letting your shoulders roll back and your neck pull up as your lungs fill with fresh air. 

Your body is likely sore from sleeping too much, or not enough, and I know that story all too well. 

You're alive today, and I challenge you to stand up, stretch the body your mind has been neglecting, and get into the shower. Practice the breathing technique in the shower or a hot bath, being mindful of how your body feels. Listen to it when it speaks today. You've got this!",0,0,0,0,1
225,"I asked him three time what happened. And after the third time I cried and went home. Month later he still don't talk to me and he and my mother started fighting for the first time in the relationship. Me and my mother honestly don't know what to do, he just ignores me. I even told him that I don't date that guy(even though I date him) and he didn't even react to it.",0,0,1,0,0
226,"I think he doesn't want to put in the effort for the relationship to work (and we're both so difficult that we have to work on our relationships, doesn't matter with whom) but he can't be without me either. What should I do? I'm afraid this is gonna happen over and over again, because I'm always forgiving him at some point. Am I being strung along? TL;DR: Boyfriend [28,M] broke up with me [23,F] after on-off for 1.5 years, I thought we just got it together and am devastated...don't know what to do, want to keep fighting but should I?",0,0,1,0,0
227,"I've decided to be celibate and kill myself. : I don't want to live, I hate life, but I have dreams, pipe dream they might be, but fucking still.

I'm about to turn 18 and my plan is to give life my best shot and try to live to the fullest until I'm 25, then I'll be hanging myself, its long enough to spare me of my suffering but also enough to experience life, if it truly does have something to offer.

The reason for celibacy is fairly obvious, If I'll be dead by 25 so It would be cruel to fall in love and break a girl like that, I simply despise casual sex, so thats off the table as well.

&amp;#x200B;

The thought of careers and retirement and all sorts of fucking stress is just lifted off my shoulders by this, I'm a bit of a hopeless romantic so love would be nice, but not at the cost of someones mental health.",0,0,1,0,0
228,"And I woke up. It took 3 nurses and some sort of shot to calm me down when I woke up and I had to lay there limp for an hour in the recovery room by myself. They then put me in the maternity ward, sharing a room with a mother who just had her baby. The second surgery was a few days later because the surgery was incomplete. I found out when the part of the baby came out and I slipped on it in the bathroom, my husband found me in a pool of blood crying on the ground.",0,0,0,1,0
229,"Dental Care Tips? : So, I'm narcoleptic and depressed. These are my two biggest disorders so I have literally no energy to take care of myself most days. My teeth are kinda neglected at the moment but I am fortunate enough to have regular dental cleanings every six months like they recommend, but that's not enough in between appointments. I'm primarily concerned about my gum health and I believe my dentist is as well.

Basically all I'm asking is how can I take extra care to make sure my teeth don't fall out when I'm thirty...? Anything and everything is appreciated.",0,0,0,1,0
230,"Alone : All alone on New year's.

My friends are out having a ball.

I've pissed off the only friend who would've wanted to spend time with me.

I'm alone.

I have no one to talk to.

Whats even the point anymore?

I'm tired of being alone.

This is what I deserve.

My heart physically aches.

I don't want to be alone.

I hate myself.",0,0,1,0,0
231,"I sent a respectful email to my primary psychiatrist explaining my thoughts on how it was inappropriate to have Paterno's picture prominently displayed. Am I fucked up in the head for thinking this wrong? In the past, I had a mild traumatic brain injury. Sometimes I over react. 24 hours post appointment, I'm still bitter about the Paterno pics.",0,0,0,0,1
232,"I can’t stop sweating, the second I cough up phlegm there is immediately more and I’m like gagging on it, my nose is stuffed and I have to actively try to breathe, I feel so uncomfortable, I’m losing my mind. I’ve hit my breaking point and I’m just sobbing uncontrollably. I’m stressing because I’ve already had to use sick time at work this year and it’s only the first week, the house is covered in all of my sick germs and I don’t have the strength to disinfect it, the laundry is piling up and the house is messy. I probably sound like an absolute baby right now but I can’t do multiple days of being incapacitated. I feel like shit and can’t do anything I need to get done.",0,0,0,1,0
233,"I barely graduated high school due to too many absences, and two semesters into college I'm taking a medical leave of absence because I'd fallen behind on coursework, past the point of being able to catch up. I'm trying to get a job but the thing is I can't promise I'm going to show up to work based on my pattern of behavior. My psychiatrist just keeps putting me on pills that don't work and I don't think my therapist can help me either because I know what steps I have to take, I just can't do it. I just think I'm not meant to be alive in today's world and I can't survive without burdening everyone else with my ineptness. Don't really want to kill myself just wish I were never born or that I could do normal things and be functional.",0,1,0,0,0
234,"I work full time, but the money I'm spending just to get by is preventing me from saving up to get a place and get ahead again. I'm 30, and I've never been in this spot before, always been successful and had a good life. But now I'm here, and I have no idea what to do. Not sure what I'm expecting out of this post. Just venting I guess.",0,1,0,0,0
235,"I do not know if I ought to, to be honest. I determined to quit drinking nine months ago, and have been sober seven weeks. But I never had any desire to quit grass, and I still don't. But I am in trauma therapy for the last four months, and my therapist has brought it up a number of times. She keeps saying it affects my motivation and depression, but it helps with bot the GAD and social anxiety.",0,0,1,1,0
236,SGV5IGd1eXMuIExhc3Qgd2VlaywgaSB3ZW50IHRocm91Z2ggdGhlIHJvdWdoZXN0IGRheSB0aGF0IG9jZCBoYXMgZXZlciB0aHJvd24gYXQgbWUsIHdoaWNoIHB1c2hlZCBtZSB0byBmaW5hbGx5IHRlbGwgbXkgbW9tIHRoYXQgSSB3YXMgZ29pbmcgdGhyb3VnaCBzZXZlcmUgYW54aWV0eSAoT0NEKSBhbmQgSSBkaWRuJ3Qga25vdyB3aGF0IHRvIGRvIGFueW1vcmUuCgpJIGNhbid0IHdhbGsgZG93biB0aGUgc3RyZWV0IHdpdGhvdXQgd29ycnlpbmcgYWJvdXQgd2hldGhlciBvciBub3QgSSBrbm9ja2VkIHNvbWVvbmUgb3ZlciB3aXRob3V0IHJlYWxpemluZyBpdCwgb3IgYnVtcGVkIHNvbWVvbmUgaW50byB0aGUgcm9hZCB3aXRob3V0IHJlYWxpemluZyBpdCwgb3Igd29ycnlpbmcgYWJvdXQgYSByYWJpZCBhbmltYWwgYml0aW5nIG1lIHdpdGhvdXQgcmVhbGl6aW5nIGl0IGFuZCBkeWluZyBmcm9tIHJhYmllcywgb3Igd29ycnlpbmcgYWJvdXQgc3RlcHBpbmcgb24gYSBuZWVkbGUgaW5mZWN0ZWQgd2l0aCBISVYsIG9yIHdvcnJ5aW5nIGFib3V0IGEgaG9tZWxlc3MgcGVyc29uIGluZmVjdGluZyBtZSB3aXRoIEhJVi9zb21ldGhpbmcgd29yc2Ugd2l0aG91dCBtZSByZWFsaXppbmcgaXQuCgpJIGNhbid0IGRyaXZlIHdpdGhvdXQgd29ycnlpbmcgYWJvdXQgd2hldGhlciBJIGhpdCBhIHBlZGVzdHJpYW4gd2l0aG91dCByZWFsaXppbmcgaXQgb24gdGhhdCByaWdodCB0dXJuLCBvciB0aGF0IGxlZnQgdHVybiwgb3IgaWYgdGhhdCBncmVlbiBsaWdodCB3YXMgcmVhbGx5IGdyZWVuIG9yIGRpZCBJIGp1c3QgcnVuIGEgcmVkIGxpZ2h0IGFuZCBydW4gb3ZlciBhIHBlZGVzdHJpYW4gY3Jvc3Npbmcgd2l0aG91dCByZWFsaXppbmcgaXQ/CgpJIGNhbid0IGdldCBuZWFyIG1vdmluZyB3YXRlciB3aXRob3V0IHdvcnJ5aW5nIGFib3V0IHRoZSBicmFpbiBlYXRpbmcgYW1vZWJhLiBJZiBJIGdldCBzcGxhc2hlZCBpbiB0aGUgZmFjZSwgSWxsIGZyZWFrIG91dCBpbnRlcm5hbGx5IGZvciB0aGUgcmVzdCBvZiB0aGUgZGF5LiBJIGNhbid0IGVhdCBmb29kIHdpdGhvdXQgd29ycnlpbmcgYWJvdXQgaXQgYmVpbmcgcG9pc29uZWQgb3Igd29ycnlpbmcgYWJvdXQgdGFwZXdvcm1zLgoKSSBjYW4ndCBoYXZlIGEgYmFzaWMgY29udmVyc2F0aW9uIHdpdGhvdXQgd29ycnlpbmcgYWJvdXQgd2hldGhlciBzb21ldGhpbmcgSSBzYXkgd2lsbCBjb21lIGJhY2sgdG8gaGF1bnQgbWUKCkkgS05PVyB0aGVzZSB0aGluZ3MgYXJlIHN0dXBpZCBhbmQgd2lsbCBwcm9iYWJseSBuZXZlciBoYXBwZW4sIGJ1dCBteSBicmFpbiBrZWVwcyBvbiB0aHJvd2luZyBtZSB0aGUgw6LigqzFk3doYXQgaWY/w6LigqzCnSBhbmQgSSB3b24ndCBiZSBhYmxlIHRvIG1vdmUgb24uIEknbGwgZXZlbiBnZXQgcGh5c2ljYWxseSBhZmZlY3RlZCBieSBteSBhbnhpZXR5LSBteSBleWVzIHdpbGwgYnVybiBhbmQgaXQgd2lsbCBnZXQgaGFyZGVyIHRvIGJyZWF0aGUKCkFueXdheSwgbXkgbW9tIHNldCB1cCBhbiBhcHBvaW50bWVudCBmb3IgYSBwc3ljaGlhdHJpc3QgKEknbSAxOCBhbmQgSSdtIHN0aWxsIG5vdCBzbWFydCBlbm91Z2gvaGF2ZSBlbm91Z2ggbW9uZXkgdG8gc2V0IG9uZSB1cCBteXNlbGYsIEkgZmVlbCB3b3J0aGxlc3MgYWxyZWFkeSwgcGxzIGRvbid0IHJlbWluZCBtZSkgYW5kIEkgd2VudCB0aGVyZSB0b2RheS4KClRoZSBndXkgc2VlbWVkIGxpa2UgYSBnb29kIGd1eSBhbmQgZXZlcnl0aGluZywgYW5kIG1hZGUgbWUgc2lnbiBwYXBlcndvcmsgYXMgSSB3YXMgdGFsa2luZyB0byBoaW0gYW5kIGV2ZXJ5dGhpbmcsIGFuZCBldmVyeXRoaW5nIHdhcyBjb29sLiBPbiB0aGUgd2F5IG91dCwgbXkgbW9tIGFza2VkIHRoZSBndXkgaG93IG11Y2ggdGhlIGJpbGwgd291bGQgYmUsIGFuZCBoZSBzYWlkIGl0IHdvdWxkIGJlIGFyb3VuZCAzMDAgZG9sbGFycyBmb3IgdGhlIGZpcnN0IHZpc2l0IGFuZCBhcm91bmQgMTUwIGZvciBldmVyeSB2aXNpdCBhZnRlciB0aGF0LgoKSSd2ZSBiZWVuIHNvIHVwc2V0IGV2ZXIgc2luY2UuIEkgZmVlbCBzbyBiYWQuIEkgdG9sZCBteSBtb20gSSBkaWRuJ3QgZmVlbCBnb29kIGdvaW5nIHRvIGEgcHN5Y2hpYXRyaXN0IGlmIGl0IHdvdWxkIGJlIHRoYXQgZXhwZW5zaXZlLCBidXQgc2hlJ3Mgc3VwZXIgc3VwZXIgc3VwcG9ydGl2ZSBhbmQgaW5zaXN0cyBvbiBtZSBnZXR0aW5nIGhlbHAgKHNoZSBnb2VzIHRocm91Z2ggYW54aWV0eSB0b28sIHRvIGEgbGVzc2VyIGV4dGVudCkuCgpUaGVuLCBteSBicmFpbiBnb3QgdGhlIGlkZWEgdGhhdCB3aGF0IGlmIHRoZSBwYXBlcnMgdGhlIGd1eSBtYWRlIG1lIHNpZ24gd2FzIHJlYWxseSBhIGNvbnRyYWN0IHRoYXQgd291bGQgY29tZSBiYWNrIHRvIGhhdW50IG1lIGxhdGVyIChleC13aGF0IGlmIEkgc2lnbmVkIGF3YXkgcGFydCBvZiBteSBmdXR1cmUgaW5jb21lLGV0Yy4pIGl0IHNvdW5kcyBzbyBzdHVwaWQgYW5kIGl0IGlzLiBNeSBicmFpbiBqdXN0IHNlZXMgZXZlcnl0aGluZyBhcyBhIHRocmVhdCBhbmQgaXMgc3R1Y2sgaW4gYSBwZXJwZXR1YWwgZmlnaHQgb3IgZmxpZ2h0IG1vZGUKCkFueXdheSwgSSBkb24ndCBrbm93IHdoYXQgdG8gZG8uIEkgZmVlbCBJaWtlIGZvciB0aGUgcGFzdCBlaWdodCBtb250aHMgSSd2ZSBqdXN0IGJlZW4gYSBkcmFpbiBvbiBteSBwYXJlbnRzIGFuZCBldmVyeW9uZSBhcm91bmQgbWUuIEFsbCBJIGFtIGlzIGEgYnVyZGVuIHRoYXQgY2FuJ3QgZXZlbiBtYWtlIG15c2VsZiBoYXBweS4gSSBmZWVsIGxpa2UgaWYgSSBkb24ndCBnbyB0byBhbnltb3JlIGFwcG9pbnRtZW50cyB3aXRoIHRoaXMgcHN5Y2hpYXRyaXN0LCBJJ2xsIGhhdmUgdGhyb3duIGF3YXkgMzAwIGJ1Y2tzIG9mIG15IG1vbSdzIG1vbmV5IGZvciBubyByZWFzb24sIGJ1dCBpZiBJIGRvIGdvIHRvIGFub3RoZXIgYXBwb2ludG1lbnQgd2l0aCBoaW0sIEknbGwgY29zdCBoZXIgMTUwIGEgcG9wLiBJIGZlZWwgbGlrZSBJJ20gdGFraW5nIGFkdmFudGFnZSBvZiBwZW9wbGUgYW5kIEkgZmVlbCBsaWtlIEknbSB0b28gc3R1cGlkIHRvIGdldCBteSBhY3QgdG9nZXRoZXIuIEkganVzdCB3YW50IHRvIGJlIGFibGUgdG8gYmUgaGFwcHkgYWdhaW4gYW5kIGhhdmUgcGVhY2Ugb2YgbWluZC4gSSd2ZSB3YXRjaGVkIG15c2VsZiBsaXRlcmFsbHkgZ28gbnV0cyBhbmQgSSBkb24ndCBrbm93IHdoYXQgdG8gZG8gYW55bW9yZS4gVG8gYWRkIHRvIGl0LCB0aGlzIGlzIGFsbCBpbiBteSBoZWFkLiBJIGNhbid0IGV2ZW4gdGVsbCByZWFsaXR5IGZyb20gb2JzZXNzaW9uIGFueW1vcmUuIFRoaXMgd2hvbGUgYmF0dGxlIHRoYXQgSSd2ZSBmb3VnaHQgZm9yIHRoZSBsYXN0IGVpZ2h0IG1vbnRocyBpcyBhbGwgaW4gbXkgaGVhZC4gSSdtIG5vdCBkb2luZyBhbnl0aGluZyBwcm9kdWN0aXZlIGJ5IGZpZ2h0aW5nIE9DRC4gSSdtIGp1c3Qgd2FzdGluZyBteSB0aW1lIGFuZCBJIGZlZWwgbGlrZSBvY2QgaXMganVzdCBteSBleGN1c2UgZm9yIGJlaW5nIHdvcnRobGVzcy4gSSBqdXN0IGZlZWwgc28gaG9wZWxlc3MgYW5kIGd1aWx0eS4=,0,0,0,1,0
