,text,Bias/Abuse,Finance/Career,Relationship,Health Concerns,None of them
346,I’m coming to find that my family are rapist sympathizers given the “right” circumstance (ie. sports). How would you want the media to change? What would make it easier to watch the news while also covering newsworthy topics? My head is in a fog still so hopefully that all made sense.,0,0,1,0,0
347,"I'm worried I have a blood clot or something that gets aggravated when I wear them. I just want to be okay and to have a good time on this trip, but I've been so out of it, and I'm at my wit's end. Right now I'm lying down and I feel blood rushing all through my head, and bulging of blood vessels around my nose. I'm extremely sleep deprived and woozy but I'm scared to go to sleep and am in pain. I'm so scared.",0,0,0,1,0
348,"Hello All, I'm 27yrs old male, 100kg 194cm. For one year and half maybe I'm suffering from: **Chronic daily headache (dull behind left eye, pressure like)** * When try to think or remember something it seems to getting worse",0,0,0,1,0
349,"what if there arent enough houses for all the people in this world? ( yes..seriously)  we have never lost him, he has never been stung by a bee, we do not have the news on around him, nor has our house been broken into.However, he has heard grown ups out in public talking about the recent school shooting. He also gets night terrors and nightmares and is afraid to fall asleep sometimes.  how do I help him manage his anxiety in an age appropriate way?",0,0,0,0,1
350,"Waiting for my mind to have a breakdown once the “New Year” feeling isn’t there anymore : I don’t know about anyone else, but I’m a little bit worried that I’ll go back to being depressed in a few days time or something. Last year, I tried not to have any breakdowns for the start of 2019. A mere 10 days later, I broke down crying. I wasn’t the same for that entire year. Up until December, where I was ok that month. Now I just wait... it’s a weird way to act and feel, but it feels a bit normal.",0,0,0,0,1
351,"I'm too unstable. Telling parents is not an option. I'm not going to give the easy redemption for them. All this is still suspicion. I know I'm no professional, but I'm telling you, I'll get help.",0,0,1,0,0
352,I’ve started writing a book online about my suicidal feelings : I hope somebody reads it. So far nobody has. Though it’s not a topic everyone is gonna want to hear by any means. But I have to get it out somehow. I can’t keeps this to myself anymore. And I have nobody else to talk to. I can’t write in a diary cause I risk family finding it. Nobody I know truly understands what I’m going through. This is all I have.  Please let somebody read my book and actually connect with it. Let me not be the only one who has the feelings. I had nothing else. The world could at least give me this. The “new year” could at least give me this. I need this.,0,0,1,0,0
353,"I know there are a lot of bad stories on here about therapy. But I was wondering about good experiences. My own experience was six weeks ago. I slipped and went on s bender, I fell into a depressive, suicidal crisis. I phoned every crisis line that exists, for ten hours, well getting drunker and drunker.",0,0,0,1,0
354,"Hello! I've found myself in between a rock and a hard place: the project I was working on lasted longer than I expected, and I've run out of money. I've been applying for local (Arizona) jobs, but most won't get back to me until after October 1st, which is my doomsday. I need 650 for rent. If I can't get it, it's over, which is frustrating and scary!",0,1,0,0,0
355,I have been reluctant to start one of these as I am really ashamed to ask for help. One of my dear friends suggested I do this as I really do not have anywhere else to ask for assistance right now. I am at a high risk for homelessness. Landlord now wants me out unless I can come up with $800 in the next couple of days. I also was recently kicked off of food stamps lately for no apparent reason and I am working to get that fixed.,0,1,0,0,0
356,"I've stopped telling it,  and when someone at work says what's wrong. I just look at them and say its been a day. I just can't really go out and do stuff. I keep pushing college back I wanted to be a nurse and now I don't want to do anything but be a hermit and go live in the woods. I'm not really looking for responses I'm just tired of people not listening or believing me, I've had it all my life and I'm just done with it.",0,0,1,0,0
357,"I have four kids full time, almost a year ago their dad was removed because of substantial abuse. It's been incredibly hard making ends meet by myself and although I get rent paid, all other bills are stuck on the back burner. Our electric bill is over $400 and they're demanding $225 as a minimum payment. It's scheduled for disconnect today and I can't put it off any longer. I know it's a long shot but seriously needing a miracle at the moment.",0,1,0,0,0
358,I literally felt her lose interest in talking to me as I said that. She asked me some basic questions and then suggested that I go into walk-in counseling that my school offers because she doesn't want to waste MY time being there. I told her that it wasnt a waste of my time and that I'm here because I want to get better. This was only my second time meeting her and we never delved into any of the main issues that I was facing but she brushed me off so quickly all because I wasn't sobbing my eyes out or felf like committing suicide. She acknowledged the fact that I wanted to stay and talk about other things in therapy but she proceeding to rush me out.,0,0,0,0,1
359,I don't know... I don't know what to do. I just want out of here. It's too hard. With this house and school work.,0,0,0,0,1
360,I'm so used to being forced to submit to him that I no longer have a voice. He heavily favors my sister over me and would buy her anything she wanted in a heartbeat. An example would be at Darvin furniture one time. He takes me and my sister there and tells her to pick out a desk. I look at a $100 discount desk and he says we don't have enough money.,1,0,1,0,0
361,"And it may be a bit out of context, but I do have to thank my 4 best men for being here with me all the way, I couldn’t do this without them. Finally, we are here at the present day. It’s been 2 years since we broke up. My ex still hates me with a burning passion, but I have learned to ignore it and have mostly moved on from the experience. I don’t hold any sort of animosity towards her, but I have had the tendency to start to drift off and start pitying myself and reflecting out loud a bit too much when in conversation with my dear friend.",0,0,1,0,0
362,"Hi. So, my husband is emotionally and mentally abusive. I've tried to leave several times but he threatens to kill himself if I do, by crashing his car or running into traffic. However, I have nowhere to go even if I do. My family dosent want/can't afford to have me live with them again.",1,1,1,0,0
363,"I'm taking care of her but I have no idea what to do with myself. **TL;DR: My wife told her co-worker that she and I were in an open relationship and started hooking up with him. She said it's because I have too high a libido, because our relationship lost it's newness, and because I don't do a fair share of housework. I'm not sure if we can work it out or if I should just leave. **",0,0,1,0,0
364,"When we returned a year ago, we had some very rough boundary issues (trying to forward face in their car, feeding baby junk, criticizing our parenting choices, etc.) with them. MIL has ""anxiety and depression"" and cannot address the issues she causes so FIL addresses them for her. It's the worst case of coddling I've ever seen. She does not see a mental health professional (because narcissist) and blames everyone else for any wrong she may do, which of course she does no wrong.",0,0,1,0,0
365,The second I can't keep my mind occupied all I can think about is killing myself im so sad I can't do this anymore,0,0,0,0,1
366,"Things my boyfriend does make me feel bad sometimes (for no reason actually), like when he doesn´t text me back for a few hours ( because he´s really busy with work but he texts me back whenever he can, I know it ) and I start having weird thoughts, like ""Is he already tired or bored of me? Is this just another guy who made me fall in love with him and think that he loves me and cares about me, and he actually doesn´t give a damn about me?"" I don´t want to have these thoughts, so I try to stop myself from thinking about that all, but sometimes I just can´t stop and I feel too bad ( for no real reason actually because I honestly feel like he loves me a lot. ). I feel like a bad anxiety attack is coming, and I can´t stop it.",0,0,1,0,0
367,"This is an idea that my father also reinforced in me heavily. I remember vividly when I told him that everything was my fault (in my child mind obviously meaning ""you make everything my fault"" which was very much the state of things in the house growing up) and he straight up told me to stop fucking up so much if I didn't want things to be my fault (I should emphasize all ""fuck ups"" were minor- letting a pack of strawberries go to waste, forgetting to call him as soon as I left school, etc- but punished severely). Hell, even if I'm in the *wrong* now I feel like I'm still a victim. I can't gauge conflict to save the life of me- even if I'm being an absolute ass, I'll feel like I'm the one who's being persecuted. My last relationship was a while ago, and lasted about a year.",0,0,1,0,0
368,I need help. I need sound advice on how I can overcome this situation. I need brutal honesty. Merci ! Please excuse my grammatical errors,0,0,0,0,1
369,Every time I tell him to leave he threatens to harm my pets or take them and release them to the wild (I have ferrets.... they CANNOT survive in the wild where I live) or he goes into rants about how useless I am and how I couldn't survive without him and somehow he worms his way back in for fear he might be right. TLDR; need him out. He threatens animals. **REALLY** don't wanna involve police. What do I do?,1,0,0,0,0
370,"Long story short: Worked in a call centre for 4 years for a vehicle breakdown service, starting to not be able to cope with it any more due to a combination of things (change in management, not enough staff for a constantly expanding customer base, rewards based on whether your face ""fits"" rather than actual demonstrable achievements, etc). Unable to relax after work, constantly thinking/dreading going to work. Get random mood swings about it, either intensely rageful, or wanting to burst in to tears. Headaches that go on for 3 or 4 days at a time are now a regular occurence. Starting to manifest in other physical ways (unable to sleep, constantly weary, having a lot more sickness than usual).",0,1,0,1,0
371,"I'm afraid about what they may do next, what they might say to me next, what they might ask me next. I just want to be by myself, in my own place, with my computer, my keyboard, my guitar, and my bed. I'm a teen, so I don't really have that choice, but to be honest, nobody really does, no matter  how old they are. You always have to be around people for one reason or another. I'm just never comfortable around people anymore.",0,0,1,0,0
372,"So for the last two years I thought I had depression. A few days ago I was diagnosed with depression. I'm starting to think I don't have depression and I'm just a bitch and I don't know how to tell if that's the case. The weirdest thing is, over the last month I've been increasingly feeling well. My life is shit becausd I missed lits of school and so I worry a lot, but that's normal. Other than that I feel.. fine. I don't feel depressed. Could it be that this is temporary or does this mean I don't have depression. The other thing is I was given pills but the thing is I don't want to take pills that might fuck me if I'm feeling ok atm. Advice?????? I need to make some decisions fast",0,0,0,1,0
373,"I hate my job, but I need to keep having income so that I can support myself. But is starting to become so hard to get out of bed that I am continuously late to work. Should I just quit? Has anyone else had a similar experience?",0,1,0,0,0
374,"I keep getting sudden, very short panic attacks. Or anxiety attacks. I'm not sure if I feel fear, I don't even know what the feeling is because I forget everything short term afterwards. They last a presumably short amount time and is the worst feeling imaginable to me. Some random thought I can never remember triggers it (it's definitely something that repeats though, it's a familiar feeling afterwards).",0,0,0,0,1
375,I never thought I’d be in a situation like that in my life and the screaming and blood and chaos following it is just on a constant repeat in my head that won’t stop. I had to give 4 separate statements to the police which burned it from start to finish in my brain and it doesn’t stop. I don’t know if that’s just because it was less than 24 hours ago and I’m still just in shock? It’s just a lot to take in right now  and I’m not sure what to do. I apologize for any formatting issues because I’m on mobile/ sounding incoherent I’m just kind of numb after all this and unsure what to do.,0,0,0,0,1
376,"Idk Do I tell someone? Do I just quit? Do I talk to her about what she did? Please, any advice would be really really helpful to me!",0,0,1,0,0
377,"I really suck at explaining things so if you have any questions please ask. UPDATE: I gave my casual partner a vague warning about the future and how, if the time comes, I'll need to make the decision for myself. tl;dr I am stuck in a love triangle with a casual DDLG relationship on one side and sharing of mutual feelings on the other. Multiple things keep the DDLG from relationship from being public and I hate sneaking around. I want to have an open relationship with the other girl.",0,0,1,0,0
378,"Every day I wake up doing nothing. Absolutely nothing except wasting my life, hoping something would happen but of course nothing would happen because I am a lonely fuck who pushes away everyone in his life while everyone else goes out and party like there is no tomorrow and fuck and cum like they are in a porno and make memories that not even one memory book is enough. Every day I wake up doing nothing. Either wasting my time playing videogames or watching the social media status scrolling up and up and up when in reality, i am doing absolutely nothing. Nothing is being absorbed in that stupid brain of mine, wherever the hell it is when I should be doing something more productive like studying or reading but either my own brain rotted to the size of a pea *(because of how mental disorders degenerate brain cells ... yay me, I am doing something at all)* or it just felt and flew up to Mars, or it is sitting its dark throne,  rubbing its pitchfork,  planning its next move on how to fuck me, both literally and figuratively.",0,1,1,0,0
379,"But in that moment neither my words nor my body made a difference...he did what he wanted.... I wanted to push him, kick him, shout...but...i couldnt move. There were times he didn't listen to me but I never thought it would lead to him forcing himself onto me. I didn't trust I'd know how he'd react if I did or said anything...He wasn't the gentle and respectful person I thought he was. I left after the shower but when I got home, I broke down.",1,0,0,0,0
380,"I feel like a complete and utter fuck up. And it just fucking hurts. I’m filled with what if’s. “What if you didn’t ever use pot and was that what made you feel physically ill?” “What if it wasn’t that, but just high anxiety?” “What if I pushed through and got the job and things turned out well? How happy would you be compared to where you are now?” (I should mention I am not at a great place in my life right now in many ways, including employment).",0,1,0,1,0
381,"Over the past couple of years I've been getting increasingly afraid of road trips. I've been terrified of dying in car accidents. I don't know entirely knowing where this fear is coming from. I was in a super minor fender bender as a teenager but that was it. In college, I lived in a city with insane traffic and regular accidents but I never experienced an accident myself.",0,0,0,0,1
382,When I try to befriend artists or thinkers or doers. They often either shun me because my work has been sub par and nearly non existant and they don't see me as equal. Or they show sexual/romantic interest I don't reciprocate which makes me nervous and avoidant. Sometimes I am shunmed I think because they mistake my interest in making friends for a romantic interest. I am quite annoyed by all the assumptions/game playing/projecting that goes on in the world.,0,0,1,0,0
383,why should i continue suffering? because it will get better? fuck this. that is not necessarily true. it can get worse. and it has been getting worse for years now. so just fuck it. i am just going to end it. nothing matters in the end.,0,0,0,0,1
384,"I can't anymore, I've tried for about 5 year now. All I got was kicks and punches from life. I fail daily tasks and cannot control myself. I hurt my surrounding and hate myself the most. I am suffering so much, yet I can't bring myself over to pull the trigger or cut with the knife. I've been going to therapy for a while but there's nothing changed, no help either. I'm thinking about taking an overdose of meds, but I don't know if it will work. If not I cannot live with the afterwards consequences I have to face. I cannot bear to live another single day either. 

I am just so done. 

If anyone I know sees this, thanks for nothing.
Thanks for thinking you're trying, yet you just secretly watched me slowly dying. 

I hope humanity gets eradicated within the next decades.",0,0,1,0,0
385,"I’m high risk for PPD seeing as I have preexisting BPD and anxiety, and going back into working immediately after giving birth would most likely be very damaging. Not to mention I haven’t had the easiest pregnancy, having had multiple emergency room stays and having been hospitalized. My goal is to have at least the required time to recover, without having to put myself in debt. Even $5 is a huge help, because that's $5 less that we'll have to borrow to cover our bills while I'm not working. <url>",0,1,0,1,1
386,"I know that I can't be unemployed forever but I'm just too anxious to really do anything. And everyone in my family keeps asking what my plan is and I keep lying because saying I've got nothing is just too humiliating. I'm just stuck. Have any of you gone through something similar, and have any advice? I appreciate it.",0,1,1,0,0
387,"sorry that seems obvious if your depressed. But like, I'm to tired to put makeup on. For the last 10 months. I'm normally a wake and face kinda gal. 
I gave up my job to go back to school full time after the birth of my youngest. Childcare is so expensive it's not worth it! So I am at home. Which I love? But hate. I keep feeling like I want to GO HOME, but there is no home to go to. I have intrusive and very specific self harm thoughts, but I'm on meds and seeing a doctor. 
Idk, does anyone else just feel LOST?",0,1,0,0,0
388,"One instance was last year when I graduated from college. There was something in me that couldnt believe and accept that I’m finally done with college. Fast forward to today, next week will mark my 1st year anniversary at work. Part of me wants to enjoy it with my parents, co-workers, and friends but another part of me wants to just forget about it and spend it as an ordinary day. Anything I should do?",0,0,0,0,1
389,"Sorry in advance for what I'm getting off me chest. This man sexually, physically, and emotionally abused me for a year. He even tried to marry me at 16 so he could trap me in his perverted hell. After four months of completely breaking free of this sick, twisted human being he had the gall to contact one of my friends to try to get a vinyl back. He treated me like a dog.",1,0,0,0,0
390,"I actually give an assistant half my emergency fee to come help me sometimes. I feel unsafe driving to ""house calls"" in the middle of the night by myself. I frequently bring my husband along as a makeshift “tech” or when I feel unsafe, which is obviously unfair to him. Unhappy Husband: My husband is miserable both with his 60 minute commute and with our isolation out here in the country. We feel like we have no social life out here.",0,0,1,0,0
391,"I love her too, but I am super paranoid about the whole deal. Current situation: We both confessed that we love each other, but I won’t be going back to my home country for another 6 months. Because of my past toxic relationship I fear things will change between us, we’ll get into fights/have trust issues etc. Problem: Should I get into a LDR with her, or we should continue being best friends( which would be hard because she has already very clearly confessed she loves me) problems are: 1.",0,0,1,0,0
392,"I just don't want to live anymore. 

My friends all ignore and exclude me.
My family are homophobic and transphobic. Which doesn't work when im a closeted  pansexaul and transgender (ftm).",1,0,0,0,0
393,"The husband's voice sounds like pure rage, the wife's both angry and defensive. A couple of times there were sounds of broken objects. We have never really talked (they don't speak good English), so I'm not sure how to approach them about it. Calling the police feels excessive, but I'm also worried someone might be abused. What is an appropriate thing to do here?",0,0,1,0,0
394,"I get anxious because I am worried about bad things that I think may happen in my life. Im worried about losing my job, my girlfriend might leave me for someone more funny, with a better job, that is more self confident etc. You think these things because you perceive yourself to have no value. I get so preoccupied with these worries and it constantly undermines my self esteem that it applies to other areas in your life, even everyday interactions, going to the store, these can be extremely stressful events. You're so unconfident in yourself that you have a million thoughts a second and constantly second guess yourself.",0,1,1,0,0
395,"Hi everyone,  Sorry to ask but today is my Mum’s birthday. This is the first month in ~6 where I haven’t been paid early, so until tomorrow I have no money. The issue is it’s my mum’s birth today, and she always wants a cake, but I am unable to give her one this year. A nice cake from my local supermarket is £10, and I will be paid by work tomorrow so I can repay you soon.",0,1,0,0,0
396,"So now they are querying whether he has a traumatic brain injury suffered a year before we got together and that now he has progressing brain damage. At this point my nurse self kicks in, I can't not help someone in that situation. I feel sorry for him I don't want him to be hurt or alone. But I also want to hate him and leave. So my incredibly long winded question to you is this: if he has brain damage is this an excuse or a reason?",0,0,1,0,0
397,"It was no longer just about the life and love we were building together. It was no longer about us, it was about me and trying to fill this hole within myself. If she would just want me, make me feel wanted, I could baptize myself in it and finally let go of all this guilt and self-hatred. This male shame. It’s complicated.",0,0,1,0,0
398,"I know every time I have panic attacks to remind myself it's just in my head, but it sucks when little things just make you feel like shit! Does anyone else get triggered by stupid things like this? ? I'm even just pissed at myself for now feeling mad at my mom, like don't you know not to tell someone with health anxiety that ""they don't look right""?? Ugh!",0,0,1,0,0
399,"I never felt so uncomfortable and scared other than the night he did put his hands on me and it was exact same feeling today. That was the scariest part. It felt like that night never ended and I was just at the peak of emotion. I know most of you will say ‘you need to leave’ or something obvious - yes I know. But things aren’t that easy and than there’s a me that is holding on to a stupid fucking thread of hope that he, of all people, will change.",1,0,0,0,0
400,"They’re like flashbacks and everything I hated that he did , I want this new person to do to me to the point where I break down again. What the fuck is wrong with me please. These are violent degrading fantasies and they make me feel like a really disturbed person. The thought after an orgasm literally makes me cry. Someone out there has to know what I’m talking about please.",1,0,1,0,0
401,"My therapist bailed, and just days later I already have a fully developed plan.
It'd be so easy. Cheap too. I could easily kill myself tomorrow. 
I keep telling myself I'm sticking around for my friend but I know I'm dragging him down, leeching off of him for support.
If I'm gone has one less task to worry about, and all my pain comes to an end.
idk seems like a win-win to me.
Sure he'd be sad for me for a bit.
But he's a busy guy. It's better this way.
I dunno what I'm doing haha. Everything just feels distant and detached for some reason.",0,0,0,0,1
402,"I feel the only thing that makes me even remotely content these days is when I convince myself when and how I'm going to kill myself. Nothing else makes me feel at ease, I'm not sure how worried about myself I should be",0,0,0,0,1
403,"Iâ€˜ve been depressed since i was 14, but today was my 22nd birthday and i finally managed to let my feelings out. I canâ€˜t tell anyone so at least i can post it here.",0,0,0,0,1
